{
  "schemaVersion": 1,
  "accountId": "493499579600",
  "region": "us-east-1",
  "clusterContext": "arn:aws:eks:us-east-1:493499579600:cluster/techx-tf2-prod",
  "chartGitSha": "0000000000000000000000000000000000000000",
  "infraGitSha": "0000000000000000000000000000000000000000",
  "contractSha256": "0000000000000000000000000000000000000000000000000000000000000000",
  "templates": [
    {
      "variant": "1a-primary-in",
      "templateId": "EXT2UboGoZ7ErXaQ",
      "revisionSha256": "22873c683fa034843990d906c49b1c89a11d82b0fef05151d27cba48819e58dd",
      "lastUpdateTime": "2026-07-29T09:33:08.205Z"
    },
    {
      "variant": "1a-primary-outside",
      "templateId": "EXT2cGQZ1Hb4HKCC",
      "revisionSha256": "35691140cc4e0a04f49e6dbcb4fb969672d94f52d99cf14e8aa564cc8c9b0ead",
      "lastUpdateTime": "2026-07-29T09:33:08.239Z"
    },
    {
      "variant": "1b-primary-in",
      "templateId": "EXTDqvVeTfQiN7zBS",
      "revisionSha256": "4357893630d1d2eb9d5d9c45f3b2f831f900ca58a9878cfa1385b07a0ad58127",
      "lastUpdateTime": "2026-07-29T09:33:08.261Z"
    },
    {
      "variant": "1b-primary-outside",
      "templateId": "EXT34dobGM9bVqZ2",
      "revisionSha256": "fd9bd879c6df1cc78f9004cb68431a2af89a7930401aa0072a767273bcd1901b",
      "lastUpdateTime": "2026-07-29T09:33:08.274Z"
    }
  ],
  "evidence": {
    "infraPreflightSha256": "0000000000000000000000000000000000000000000000000000000000000000",
    "capacity1aTo1bSha256": "0000000000000000000000000000000000000000000000000000000000000000",
    "capacity1bTo1aSha256": "0000000000000000000000000000000000000000000000000000000000000000",
    "auditAlarmSha256": "0000000000000000000000000000000000000000000000000000000000000000"
  },
  "CapacityApproved": "PASS",
  "ChangeApproved": "PASS",
  "approvedBy": "REPLACE_ME",
  "changeReference": "REPLACE_ME",
  "approvedAt": "2026-07-29T00:00:00Z",
  "expiresAt": "2026-07-29T01:00:00Z"
}
